{
  "$schema": "https://json-schema.org/draft/2020-12/schema",
  "$id": "https://huibozi.github.io/claude-code-unified-research/agent.schema.json",
  "title": "Agent",
  "type": "object",
  "additionalProperties": false,
  "required": [
    "id",
    "agent_type",
    "source",
    "model",
    "compute_profile",
    "tools",
    "skills",
    "permission_mode",
    "memory_scope",
    "isolation",
    "max_turns",
    "hooks",
    "required_connectors"
  ],
  "properties": {
    "id": {
      "type": "string"
    },
    "agent_type": {
      "type": "string"
    },
    "source": {
      "type": "string"
    },
    "name": {
      "type": "string"
    },
    "model": {
      "type": "string"
    },
    "compute_profile": {
      "type": "string",
      "enum": [
        "low",
        "balanced",
        "high"
      ]
    },
    "tools": {
      "type": "array",
      "items": {
        "type": "string"
      }
    },
    "disallowed_tools": {
      "type": "array",
      "items": {
        "type": "string"
      }
    },
    "skills": {
      "type": "array",
      "items": {
        "type": "string"
      }
    },
    "permission_mode": {
      "type": "string"
    },
    "memory_scope": {
      "type": "string",
      "enum": [
        "session",
        "local",
        "project",
        "user",
        "shared",
        "mixed"
      ]
    },
    "memory_refs": {
      "type": "array",
      "items": {
        "type": "string"
      }
    },
    "accepts_handoff_from": {
      "type": "array",
      "items": {
        "type": "string"
      }
    },
    "isolation": {
      "type": "string"
    },
    "max_turns": {
      "type": "integer",
      "minimum": 0
    },
    "hooks": {
      "type": "array",
      "items": {
        "type": "string"
      }
    },
    "required_connectors": {
      "type": "array",
      "items": {
        "type": "string"
      }
    },
    "adapter_notes": {
      "type": "object"
    }
  }
}
