{
  "id": "openclaw-coder",
  "agent_type": "worker",
  "source": "openclaw",
  "model": "claude-4.6",
  "compute_profile": "balanced",
  "tools": [
    "shell",
    "file_read",
    "file_edit",
    "mcp_resources"
  ],
  "skills": [
    "repo-audit",
    "task-execution"
  ],
  "permission_mode": "ask",
  "memory_scope": "mixed",
  "memory_refs": [
    "research-store",
    "shared-learnings"
  ],
  "accepts_handoff_from": [
    "daily"
  ],
  "isolation": "none",
  "max_turns": 0,
  "hooks": [
    "pre_tool_use",
    "post_tool_use"
  ],
  "required_connectors": [
    "filesystem",
    "github",
    "local-mcp"
  ],
  "adapter_notes": {
    "runtime_config_surface": "openclaw.json",
    "physical_agent_dir": "C:\\Users\\huibozi\\.openclaw\\agents\\research\\agent",
    "discovery_mode": "listed"
  }
}
